{"schema":"atrinik-directory-v1","generation":"42","generatedAt":"1786219200","expiresAt":"1786233600","servers":[{"serverId":"1111111111111111111111111111111111111111111111111111111111111111","certificateSha256":"1111111111111111111111111111111111111111111111111111111111111111","name":"Atrinik \"Alpha\"","description":"Cooperative Ω","region":"eu-west","protocol":{"major":1,"minor":0},"content":{"id":"atrinik-main","revisionSha256":"aaaaaaaaaaaaaaaaaaaaaaaaaaaaaaaaaaaaaaaaaaaaaaaaaaaaaaaaaaaaaaaa"},"players":{"online":3,"capacity":64},"status":"online","passwordRequired":false,"endpoint":{"hostname":"alpha.example.org","port":13327}},{"serverId":"2222222222222222222222222222222222222222222222222222222222222222","certificateSha256":"2222222222222222222222222222222222222222222222222222222222222222","name":"Beta","description":"","protocol":{"major":1,"minor":7},"content":{"id":"atrinik-season-1","revisionSha256":"bbbbbbbbbbbbbbbbbbbbbbbbbbbbbbbbbbbbbbbbbbbbbbbbbbbbbbbbbbbbbbbb"},"players":{"online":64,"capacity":64},"status":"full","passwordRequired":true}]}
